company,store_name,address,latitude,longitude
サンドラッグ,サンドラッグ 八橋大畑店,秋田県秋田市八橋大畑１丁目６−３７,39.7349519,140.0985724
サンドラッグ,サンドラッグ 土崎自衛隊通店,秋田県秋田市土崎港北２丁目１７−６４,39.7615579,140.0817865
サンドラッグ,サンドラッグ 大館東台店,秋田県大館市東台２丁目１−５,40.2706915,140.5742291
サンドラッグ,サンドラッグ 新国道店,秋田県秋田市高陽幸町１４−２９,39.7250449,140.1070298
サンドラッグ,サンドラッグ 横手店,秋田県横手市婦気大堤下久保１５,39.3064017,140.5505183
サンドラッグ,サンドラッグ 能代南店,秋田県能代市寿域長根５２−３,40.19212479999999,140.0278903
サンドラッグ,サンドラッグ 鷹巣店,秋田県北秋田市栄前綱７６−７２,40.23161229999999,140.3798989
サンドラッグ,サンドラッグ湯沢インター店,秋田県湯沢市元清水４丁目３−２４,39.170963,140.4830872
スーパードラッグアサヒ,スーパードラッグアサヒ 八橋店,秋田県秋田市寺内蛭根１丁目１５−２８,39.7266962,140.0872491
スーパードラッグアサヒ,スーパードラッグアサヒ 外旭川店,秋田県秋田市外旭川四百刈２２,39.7490684,140.0984679
スーパードラッグアサヒ,スーパードラッグアサヒ 大曲店,秋田県大仙市戸蒔錨１６９,39.4545472,140.4973718
スーパードラッグアサヒ,スーパードラッグアサヒ 湯沢店,秋田県湯沢市万石２４２,39.1573456,140.4837741
スーパードラッグアサヒ,スーパードラッグアサヒ 秋田中央店,秋田県秋田市泉北４丁目３−２,39.7368663,140.110446
スーパードラッグアサヒ,スーパードラッグアサヒ 秋田勝平店,秋田県秋田市新屋松美町１１−３８,39.6987367,140.0792933
スーパードラッグアサヒ,スーパードラッグアサヒ 秋田広面店,秋田県秋田市広面近藤堰越４３−１,39.72999310000001,140.145873
スーパードラッグアサヒ,スーパードラッグアサヒ 能代店,秋田県能代市東大瀬５−１,40.191792,140.03576
スーパードラッグアサヒ,スーパードラッグアサヒ 角館店,秋田県仙北市角館町下菅沢２２−１,39.589111,140.573859
スーパードラッグアサヒ,スーパードラッグアサヒ大曲田町店,秋田県大仙市大曲田町２−２５,39.4527702,140.4809931
スーパードラッグアサヒ,スーパードラッグアサヒ大館店,秋田県大館市有浦２丁目１−２０,40.282731,140.563021
スーパードラッグアサヒ,スーパードラッグメガ 新国道店,秋田県秋田市八橋鯲沼町１０−１１,39.7329403,140.099619
セイムス,ドラッグセイムス 本荘中梵天店,秋田県由利本荘市中梵天１３２,39.38713509999999,140.0618536
セイムス,ドラッグセイムス 本荘大門店,秋田県由利本荘市裏尾崎町５０−４,39.3883967,140.0471507
セイムス,ドラッグセイムス 秋田新屋店,秋田県秋田市新屋豊町６−３７,39.7049669,140.0867217
ツルハドラッグ,ツルハドラッグ フレスポ本荘店,秋田県由利本荘市石脇田頭１９５−２,39.38935620000001,140.0279026
ツルハドラッグ,ツルハドラッグ 中仙店,秋田県大仙市長野柳田61番地,39.5451549,140.5416628
ツルハドラッグ,ツルハドラッグ 中仙店,秋田県大仙市柳田61番地,39.5451821,140.5390782514
ツルハドラッグ,ツルハドラッグ 五城目店,秋田県南秋田郡五城目町西磯ノ目１丁目2−３,39.9425536,140.1115172
ツルハドラッグ,ツルハドラッグ 仁賀保店,秋田県にかほ市平沢上町田１９−９,39.289134,139.9734665
ツルハドラッグ,ツルハドラッグ 八竜店,秋田県山本郡三種町浜田東浜田334番地,40.1002617,140.002372
ツルハドラッグ,ツルハドラッグ 八郎潟店,秋田県南秋田郡八郎潟町上沖谷地47−１,39.9453076,140.0839492
ツルハドラッグ,ツルハドラッグ 八郎潟店,秋田県南秋田郡八郎潟町字上沖谷地47－1,39.9453076161193,140.083949153661
ツルハドラッグ,ツルハドラッグ 刈和野店,秋田県大仙市刈和野沼田１２−１,39.5469918,140.3675485
ツルハドラッグ,ツルハドラッグ 十文字店,秋田県横手市十文字町佐賀会上沖田277番地,39.2176993,140.5166573
ツルハドラッグ,ツルハドラッグ 合川店,秋田県北秋田市李岱豊田36番１,40.155312,140.313949
ツルハドラッグ,ツルハドラッグ 向能代店,秋田県能代市落合下大野78番地,40.2229339,140.0312163
ツルハドラッグ,ツルハドラッグ 外旭川店,秋田県秋田市外旭川小谷地33番地1,39.7521485,140.0975658
ツルハドラッグ,ツルハドラッグ 大仙協和店,秋田県大仙市協和境岸館73番地1,39.6064724,140.3296026
ツルハドラッグ,ツルハドラッグ 大仙大曲東店,秋田県大仙市戸蒔東８９,39.4588104,140.4967421
ツルハドラッグ,ツルハドラッグ 大内店,秋田県由利本荘市大内三川三川34番地2,39.4448799,140.1073083
ツルハドラッグ,ツルハドラッグ 大曲川目店,秋田県大仙市川目町東７7番地,39.4305072,140.4855158
ツルハドラッグ,ツルハドラッグ 大曲川目店,秋田県大仙市川目字町東7番地,39.430507215281786,140.48551584770132
ツルハドラッグ,ツルハドラッグ 大曲店,秋田県大仙市戸蒔錨27番地,39.4515027,140.4956547
ツルハドラッグ,ツルハドラッグ 大曲田町店,秋田県大仙市大曲田町１−２７,39.4535819,140.4811097
ツルハドラッグ,ツルハドラッグ 大曲福田店,秋田県大仙市福田町２２−２３−６,39.4702117,140.4811908
ツルハドラッグ,ツルハドラッグ 大館中道店,秋田県大館市中道２丁目２−５４,40.282456,140.554949
ツルハドラッグ,ツルハドラッグ 大館北店,秋田県大館市釈迦内稲荷山下２５８,40.295767,140.559629
ツルハドラッグ,ツルハドラッグ 大館南店,秋田県大館市餌釣前田１６５,40.2467064,140.5716124
ツルハドラッグ,ツルハドラッグ 大館南店,秋田県大館市字前田165,40.24670642112024,140.57161242698365
ツルハドラッグ,ツルハドラッグ 大館店,秋田県大館市片山町３丁目１−１,40.2741354,140.5381245
ツルハドラッグ,ツルハドラッグ 大館東店,秋田県大館市大田面31番地,40.2872964,140.583293
ツルハドラッグ,ツルハドラッグ 天王西店,秋田県潟上市天王上江川４７−２９０,39.8828002,139.9827334
ツルハドラッグ,ツルハドラッグ 天王長沼店,秋田県潟上市天王長沼9番2号,39.8121484,140.0501374
ツルハドラッグ,ツルハドラッグ 本荘中央店,秋田県由利本荘市岩渕下１８,39.3906159,140.0512146
ツルハドラッグ,ツルハドラッグ 本荘南店,秋田県由利本荘市二番堰５４,39.3784262,140.0550991
ツルハドラッグ,ツルハドラッグ 本荘店,秋田県由利本荘市中梵天１０８番,39.3862534,140.0618897
ツルハドラッグ,ツルハドラッグ 東能代店,秋田県能代市鰄渕古屋布77−１,40.1889875,140.0784075
ツルハドラッグ,ツルハドラッグ 東通店,秋田県秋田市東通８丁目１−３１,39.7121966,140.1411402
ツルハドラッグ,ツルハドラッグ 横手大森店,秋田県横手市大森町大中島３５５355番地,39.3418563,140.4321574
ツルハドラッグ,ツルハドラッグ 横手大森店,秋田県横手市大森町字大中島355番地,39.341856271095246,140.43215744661072
ツルハドラッグ,ツルハドラッグ 横手寿町店,秋田県横手市寿町１−３５,39.3132313,140.5635776
ツルハドラッグ,ツルハドラッグ 横手平和町店,秋田県横手市平和町１５−３１,39.3084526,140.5711056
ツルハドラッグ,ツルハドラッグ 横手平鹿店,秋田県横手市平鹿町中吉田竹原９０−１,39.2700799,140.4967134
ツルハドラッグ,ツルハドラッグ 横手平鹿病院前店,秋田県横手市横手町五ノ口２８−１,39.3145938,140.5475239
ツルハドラッグ,ツルハドラッグ 横手平鹿病院前店,秋田県横手市字五ノ口２８－１,39.314593804990366,140.54752391216434
ツルハドラッグ,ツルハドラッグ 毛馬内店,秋田県鹿角市十和田毛馬内南陣場30番地1,40.262744,140.7689352
ツルハドラッグ,ツルハドラッグ 湯沢大町店,秋田県湯沢市大町２丁目１10号,39.16301199999999,140.491622
ツルハドラッグ,ツルハドラッグ 湯沢大町店,秋田県湯沢市大町二丁目1番10号,39.163012,140.491622
ツルハドラッグ,ツルハドラッグ 湯沢店,秋田県湯沢市両神２８−１,39.1721386,140.4802872
ツルハドラッグ,ツルハドラッグ 潟上昭和店,秋田県潟上市昭和乱橋下畑９８番地,39.863013,140.0616867
ツルハドラッグ,ツルハドラッグ 琴丘店,秋田県山本郡三種町鹿渡西小瀬川157番,40.0341418,140.0782044
ツルハドラッグ,ツルハドラッグ 田沢湖店,秋田県仙北市田沢湖生保内街道ノ上７１−１,39.7004286,140.7283452
ツルハドラッグ,ツルハドラッグ 男鹿店,秋田県男鹿市脇本脇本石館１６,39.9094754,139.9070336
ツルハドラッグ,ツルハドラッグ 男鹿払戸店,秋田県男鹿市払戸大堤１２７番1,39.92999349999999,139.9363222
ツルハドラッグ,ツルハドラッグ 男鹿船川店,秋田県男鹿市船川港比詰大巻１４４−１,39.9017684,139.8624824
ツルハドラッグ,ツルハドラッグ 秋田中通店,秋田県秋田市中通２丁目１−４６,39.716523,140.122862
ツルハドラッグ,ツルハドラッグ 秋田中野店,秋田県秋田市下新城中野琵琶沼431番2,39.7976309,140.0608476
ツルハドラッグ,ツルハドラッグ 秋田中野店,秋田県秋田市字琵琶沼431番2,39.7976309,140.0608476
ツルハドラッグ,ツルハドラッグ 秋田仁井田店,秋田県秋田市仁井田新田２丁目５−１６,39.6788306,140.1255576
ツルハドラッグ,ツルハドラッグ 秋田八橋店,秋田県秋田市八橋新川向８−３０,39.7284601,140.1040747
ツルハドラッグ,ツルハドラッグ 秋田土崎店,秋田県秋田市土崎港北７丁目２−２４,39.7670172,140.069402
ツルハドラッグ,ツルハドラッグ 秋田土崎店,秋田県秋田市土崎港北七丁目2番24号,39.76701718142139,140.06940197763
ツルハドラッグ,ツルハドラッグ 秋田寺内店,秋田県秋田市寺内油田１丁目４−１０,39.7322208,140.0911373
ツルハドラッグ,ツルハドラッグ 秋田将軍野店,秋田県秋田市将軍野東３丁目６−４１,39.7589967,140.0878094
ツルハドラッグ,ツルハドラッグ 秋田将軍野店,秋田県秋田市将軍野東三丁目6番41号,39.75899671440041,140.08780940589884
ツルハドラッグ,ツルハドラッグ 秋田山王店,秋田県秋田市山王５丁目７−１６,39.7148638,140.1043182
ツルハドラッグ,ツルハドラッグ 秋田山王店,秋田県秋田市山王五丁目7番16号,39.7148638,140.1043182
ツルハドラッグ,ツルハドラッグ 秋田川尻店,秋田県秋田市川尻御休町５−２７,39.713507,140.096519
ツルハドラッグ,ツルハドラッグ 秋田川尻西店,秋田県秋田市川尻大川町２−１５,39.7118976,140.0931931
ツルハドラッグ,ツルハドラッグ 秋田広面北店,秋田県秋田市広面蓮沼９４−１,39.7258307,140.1505498
ツルハドラッグ,ツルハドラッグ 秋田広面店,秋田県秋田市広面樋ノ沖９３−１,39.7166839,140.1490168
ツルハドラッグ,ツルハドラッグ 秋田広面西店,秋田県秋田市広面鍋沼10−１,39.7158555,140.1481809
ツルハドラッグ,ツルハドラッグ 秋田御所野店,秋田県秋田市御所野元町１丁目１−１７,39.6613108,140.1638474
ツルハドラッグ,ツルハドラッグ 秋田手形店,秋田県秋田市手形山崎９２−３３,39.72087,140.131667
ツルハドラッグ,ツルハドラッグ 秋田楢山店,秋田県秋田市楢山川口境４−２１,39.7041989,140.110616
ツルハドラッグ,ツルハドラッグ 秋田泉北店,秋田県秋田市泉北１丁目１７−３４,39.73411979999999,140.1019578
ツルハドラッグ,ツルハドラッグ 秋田泉北店,秋田県秋田市1丁目17番34号,39.73411982943502,140.1019577783264
ツルハドラッグ,ツルハドラッグ 秋田泉南店,秋田県秋田市泉南３丁目２３−２４,39.7291506,140.1146065
ツルハドラッグ,ツルハドラッグ 秋田牛島店,秋田県秋田市仁井田二ツ屋１丁目４−５５,39.6939332,140.1224318
ツルハドラッグ,ツルハドラッグ 米内沢店,秋田県北秋田市米内沢東川向５,40.1250302,140.3696093
ツルハドラッグ,ツルハドラッグ 美郷天神堂店,秋田県仙北郡美郷町天神堂赤城１６７−１,39.41448949999999,140.5510383
ツルハドラッグ,ツルハドラッグ 美郷店,秋田県仙北郡美郷町土崎上宿２４０,39.457258,140.576352
ツルハドラッグ,ツルハドラッグ 羽後店,秋田県雄勝郡羽後町南西馬音内２１３,39.1939254,140.4100041
ツルハドラッグ,ツルハドラッグ 能代二ツ井店,秋田県能代市二ツ井町中坪１２,40.2080957,140.2332889
ツルハドラッグ,ツルハドラッグ 能代北店,秋田県能代市落合上前田１６１161番地,40.227235,140.024525
ツルハドラッグ,ツルハドラッグ 能代店,秋田県能代市寺向７３,40.182435,140.052287
ツルハドラッグ,ツルハドラッグ 能代花園店,秋田県能代市花園町２６−２６,40.19969220000001,140.0232047
ツルハドラッグ,ツルハドラッグ 能代長崎店,秋田県能代市長崎９１,40.185453,140.0214876
ツルハドラッグ,ツルハドラッグ 若竹町店,秋田県大仙市若竹町３３−１１,39.4688205,140.4700547
ツルハドラッグ,ツルハドラッグ 茨島店,秋田県秋田市茨島４丁目３−２１,39.6957026,140.0996603
ツルハドラッグ,ツルハドラッグ 角館店,秋田県仙北市角館町上菅沢449番地1,39.5935805,140.5758536
ツルハドラッグ,ツルハドラッグ 象潟北店,秋田県にかほ市象潟町大門先６−３,39.219295,139.9019257
ツルハドラッグ,ツルハドラッグ 象潟店,秋田県にかほ市象潟町武道島１４９−２,39.2058069,139.9043374
ツルハドラッグ,ツルハドラッグ 雄物川店,秋田県横手市雄物川町沼館沼館４５６−１,39.2949952,140.4308419
ツルハドラッグ,ツルハドラッグ 鷹巣店,秋田県北秋田市栄中綱60番地,40.23047510000001,140.3765901
ツルハドラッグ,ツルハドラッグ 鹿角中央店,秋田県鹿角市花輪下中島８２−１,40.189823,140.787506
ツルハドラッグ,ツルハドラッグ 鹿角店,秋田県鹿角市花輪下タ町２０２,40.2009577,140.7933308
ハッピードラッグ,ハッピー・ドラッグ 北秋田鷹巣店,秋田県北秋田市米代町５−１４,40.2231203,140.3676076
ハッピードラッグ,ハッピー・ドラッグ 大館比内店,秋田県大館市比内町扇田伊勢堂岱１８３−１,40.226138,140.5874095
ハッピードラッグ,ハッピー・ドラッグ 大館片山店,秋田県大館市片山町２丁目25−６,40.2736974,140.5423534
ハッピードラッグ,ハッピー・ドラッグ 由利本荘石脇店,秋田県由利本荘市石脇田尻野２２−１３,39.395651,140.0305499
ハッピードラッグ,ハッピー・ドラッグ 秋田保戸野店,秋田県秋田市保戸野原の町１５−８,39.7285255,140.1153003
ハッピードラッグ,ハッピー・ドラッグ 秋田土崎東店,秋田県秋田市土崎港東３丁目２−２６,39.7574339,140.0769953
ハッピードラッグ,ハッピー・ドラッグ 秋田小坂店,秋田県鹿角郡小坂町小坂五十刈１０−４,40.3241713,140.7423668
ハッピードラッグ,ハッピー・ドラッグ 秋田新屋店,秋田県秋田市新屋鳥木町３−２,39.67582549999999,140.0893124
ハッピードラッグ,ハッピー・ドラッグ 能代北店,秋田県能代市落合上前田１６９,40.2257964,140.0261318
ハッピードラッグ,ハッピー・ドラッグ 能代南店,秋田県能代市東大瀬５１−３,40.1907733,140.0373196
ハッピードラッグ,ハッピー・ドラッグ 鹿角毛馬内店,秋田県鹿角市十和田毛馬内中陣場１１１−１,40.26199340000001,140.7709407
ハッピードラッグ,ハッピー・ドラッグ 鹿角花輪店,秋田県鹿角市花輪上花輪２３７,40.1859534,140.7879305
マツモトキヨシ,ドラッグストア マツモトキヨシ メルシティ潟上店,秋田県潟上市飯田川飯塚上堤敷６９−１,39.9036311,140.0838938
マツモトキヨシ,薬 マツモトキヨシ イオンモール秋田店,秋田県秋田市御所野地蔵田１丁目１−１,39.6635815,140.1614645
マツモトキヨシ,薬 マツモトキヨシ 秋田駅ビルALS店,秋田県秋田市中通７丁目２−１,39.7176956,140.1287829
不明,ヘルスドラッグ須藤 マックスバリュ にかほ店,秋田県にかほ市平沢天ケ町８２,39.2885095,139.9728536
不明,ベストドラッグ井川店,秋田県南秋田郡井川町北川尻新坂９０−１,39.9166207,140.0973573
不明,㈲ヘルスドラッグ須藤,秋田県にかほ市平沢清水５０−１０,39.289851,139.962293
不明,五城目中央ドラッグ,秋田県南秋田郡五城目町下タ町１９３,39.9460913,140.1205537
薬王堂,薬王堂 にかほ平沢店,秋田県にかほ市平沢館ケ森１−８,39.2847468,139.969476
薬王堂,薬王堂 にかほ象潟店,秋田県にかほ市象潟町沖ノ田１−１,39.2049373,139.9048332
薬王堂,薬王堂 三種八竜店,秋田県山本郡三種町浜田東浜田３３０,40.1007673,140.0024556
薬王堂,薬王堂 三種森岳店,秋田県山本郡三種町森岳岩瀬２２０−１,40.1003474,140.0798077
薬王堂,薬王堂 中仙店,秋田県大仙市北長野茶畑１１７,39.5465231,140.5443079
薬王堂,薬王堂 北秋田鷹巣店,秋田県北秋田市鷹巣西中岱４６−１,40.2223567,140.3603026
薬王堂,薬王堂 十文字梨木店,秋田県横手市十文字町梨木村北７３−１,39.2363485,140.5301557
薬王堂,薬王堂 大仙太田店,秋田県大仙市太田町横沢相野４２０,39.5063135,140.5955316
薬王堂,薬王堂 大仙神岡店,秋田県大仙市神宮寺大浦前３０−１,39.4987201,140.4158776
薬王堂,薬王堂 大仙高梨店,秋田県大仙市高梨金堀２６７−１,39.46027429999999,140.5078907
薬王堂,薬王堂 大曲佐野町店,秋田県大仙市佐野町８−１６,39.469629,140.4698115
薬王堂,薬王堂 大曲四ツ屋店,秋田県大仙市高関上郷不動堂１６７−１,39.487365,140.493739
薬王堂,薬王堂 大曲福田店,秋田県大仙市福田町２２−２１−４,39.46887,140.481075
薬王堂,薬王堂 大曲飯田店,秋田県大仙市飯田屋舗通７５−１,39.4459051,140.4811149
薬王堂,薬王堂 大館SC店,秋田県大館市御成町４丁目３−１３,40.2801525,140.5610864
薬王堂,薬王堂 大館店,秋田県大館市観音堂４２０,40.283623,140.574592
薬王堂,薬王堂 大館比内店,秋田県大館市比内町扇田長岡下４４,40.2198651,140.5871084
薬王堂,薬王堂 大館水門町店,秋田県大館市水門町６−２,40.2753512,140.5538297
薬王堂,薬王堂 大館田代店,秋田県大館市岩瀬羽貫谷地山下９３−９,40.2800141,140.458475
薬王堂,薬王堂 横手八幡店,秋田県横手市八幡上長田２５,39.3275546,140.5510349
薬王堂,薬王堂 横手増田店,秋田県横手市増田町増田月山西２９−１,39.2007078,140.5402114
薬王堂,薬王堂 横手大雄店,秋田県横手市大雄精兵村６−１,39.3364552,140.4854891
薬王堂,薬王堂 横手平鹿店,秋田県横手市平鹿町浅舞福田２２０−１,39.2682499,140.4899197
薬王堂,薬王堂 横手幸町店,秋田県横手市幸町３−５８,39.323673,140.565062
薬王堂,薬王堂 横手店,秋田県横手市条里２丁目４−１２,39.31312399999999,140.5542815
薬王堂,薬王堂 横手赤坂店,秋田県横手市赤坂大道添３８,39.303034,140.5402459
薬王堂,薬王堂 横手雄物川店,秋田県横手市雄物川町造山字広田表１５−１,39.275446,140.4293363
薬王堂,薬王堂 湯沢倉内店,秋田県湯沢市倉内川原田１７−２,39.1745098,140.4726499
薬王堂,薬王堂 湯沢古館店,秋田県湯沢市古館町７−４２,39.1718371,140.4905932
薬王堂,薬王堂 湯沢田町店,秋田県湯沢市田町２丁目３−３８,39.1587277,140.4896948
薬王堂,薬王堂 湯沢稲川店,秋田県湯沢市川連町大舘疣橋５７,39.1474621,140.5728113
薬王堂,薬王堂 湯沢雄勝店,秋田県湯沢市小野新田81番,39.0613557,140.4574103
薬王堂,薬王堂 潟上天王店,秋田県潟上市天王二田２０８−１,39.8812019,139.9961401
薬王堂,薬王堂 潟上追分店,秋田県潟上市天王長沼６４−１６８,39.818144,140.0495688
薬王堂,薬王堂 由利本荘大内店,秋田県由利本荘市岩谷町西越９４−３,39.4434464,140.0856296
薬王堂,薬王堂 由利本荘矢島店,秋田県由利本荘市矢島町城内築舘１５９−１,39.23516559999999,140.1394169
薬王堂,薬王堂 由利本荘石脇店,秋田県由利本荘市石脇田中９４−２,39.3906378,140.0256755
薬王堂,薬王堂 由利本荘荒町店,秋田県由利本荘市荒町真城２０−１,39.3571327,140.0799062
薬王堂,薬王堂 由利本荘薬師堂店,秋田県由利本荘市薬師堂谷地４５,39.371034,140.051576
薬王堂,薬王堂 由利本荘裏尾崎店,秋田県由利本荘市裏尾崎町７,39.3875607,140.0488617
薬王堂,薬王堂 由利本荘西目店,秋田県由利本荘市西目町沼田新道下２−５３８,39.3464016,140.0134184
薬王堂,薬王堂 男鹿SC店,秋田県男鹿市船越内子２１８−１,39.9022361,139.936026
薬王堂,薬王堂 男鹿船川店,秋田県男鹿市船川港船川海岸通り一号８−３,39.8834264,139.8501227
薬王堂,薬王堂 秋田五城目店,秋田県南秋田郡五城目町七倉南秋田郡五城目町七倉１６番5,39.94434,140.1102764
薬王堂,薬王堂 秋田井川店,秋田県南秋田郡井川町浜井川荒田堰１６２,39.90946400000001,140.077041
薬王堂,薬王堂 秋田八峰店,秋田県山本郡八峰町八森湯の尻１７−１,40.3366787,140.0301148
薬王堂,薬王堂 秋田八郎潟店,秋田県南秋田郡八郎潟町昼根下１０１−１,39.9446811,140.082481
薬王堂,薬王堂 秋田六郷店,秋田県仙北郡美郷町野中中明子１０６番,39.4245284,140.5555231
薬王堂,薬王堂 秋田十文字店,秋田県横手市十文字町佐賀会下沖田６１−５,39.2182206,140.5186268
薬王堂,薬王堂 秋田土崎港店,秋田県秋田市土崎港西５丁目９−２４,39.7638038,140.0666758
薬王堂,薬王堂 秋田外旭川店,秋田県秋田市外旭川小谷地６１,39.7531914,140.0955577
薬王堂,薬王堂 秋田天徳寺通店,秋田県秋田市泉三嶽根７−２３,39.7369068,140.1205608
薬王堂,薬王堂 秋田東通店,秋田県秋田市東通７丁目７−１６,39.7116436,140.137729
薬王堂,薬王堂 秋田羽後店,秋田県雄勝郡羽後町南西馬音内２０１,39.195128,140.4114682
薬王堂,薬王堂 秋田茨島店,秋田県秋田市卸町５丁目６−１,39.6939868,140.105288
薬王堂,薬王堂 秋田角館店,秋田県仙北市角館町小勝田中川原１３２,39.594188,140.5538856
薬王堂,薬王堂 能代二ツ井店,秋田県能代市二ツ井町道上中坪３２−１,40.2056623,140.2307312
薬王堂,薬王堂 能代出戸店,秋田県能代市出戸後６−２３,40.197328,140.0250175
薬王堂,薬王堂 能代寺向店,秋田県能代市寺向９３−１,40.1842719,140.0519915
薬王堂,薬王堂 能代落合店,秋田県能代市落合下前田１９３,40.2242462,140.0251226
薬王堂,薬王堂 角館下菅沢店,秋田県仙北市角館町下菅沢９８,39.5877305,140.5729259
薬王堂,薬王堂 鹿角花輪高井田店,秋田県鹿角市花輪高井田59−３３,40.18052369999999,140.7865833
薬王堂,薬王堂北秋田米内沢店,秋田県北秋田市米内沢諏訪岱１４６−８,40.1193364,140.3794116
薬王堂,薬王堂大曲川目店,秋田県大仙市飯田大道端１７４−２,39.4346882,140.4842534
薬王堂,薬王堂潟上飯田川店,秋田県潟上市飯田川和田妹川千刈８−３,39.8864738,140.0732364
薬王堂,薬王堂鹿角花輪店,秋田県鹿角市花輪鉄砲１８−１,40.2232382,140.787288
