company,store_name,address
(有)クスリのヤシマ堂,(有)クスリのヤシマ堂,宮城県栗原市一迫真坂高橋７−７
くすりのいしかわ,くすりのいしかわ,宮城県黒川郡大郷町大松沢築道西９１−１
くすりのおおくま,くすりのおおくま,宮城県亘理郡亘理町逢隈下郡明神１７４−２
くすりの高橋,くすりの高橋,宮城県多賀城市中央３丁目１−２５
アークドラッグ,アークドラッグ 仙台泉店,宮城県仙台市泉区大沢３丁目９−１ホームセンタームサシ仙台泉店内
イオンドラッグ,イオンドラッグ新利府,宮城県宮城郡利府町新中道３丁目１−１
イオンドラッグ,イオンドラッグ船岡店,宮城県柴田郡柴田町西船迫２丁目１−１５
ウエルシア,PUDOステーション ウエルシア仙台沖野店,宮城県仙台市若林区沖野２丁目１６−２０望月製餡所
ウエルシア,ウエルシア仙台あすと長町店,宮城県仙台市太白区八本松２丁目２−８
ウエルシア,ウエルシア仙台中山店,宮城県仙台市青葉区中山５丁目２−３
ウエルシア,ウエルシア仙台八乙女中央店,宮城県仙台市泉区八乙女中央５丁目１３−１１
ウエルシア,ウエルシア仙台八木山南店,宮城県仙台市太白区八木山南２丁目１291F
ウエルシア,ウエルシア仙台富沢西店,宮城県仙台市太白区富沢西４丁目２０−１６
ウエルシア,ウエルシア仙台市名坂店,宮城県仙台市泉区市名坂山岸５１−３
ウエルシア,ウエルシア仙台木町通店,宮城県仙台市青葉区木町通１丁目８−１
ウエルシア,ウエルシア仙台柳生店,宮城県仙台市太白区柳生３丁目４−２
ウエルシア,ウエルシア仙台沖野店,宮城県仙台市若林区沖野２丁目１６−２０
ウエルシア,ウエルシア仙台泉中央一丁目店,宮城県仙台市泉区泉中央１丁目20−１
ウエルシア,ウエルシア仙台泉中央店,宮城県仙台市泉区泉中央４丁目20−１
ウエルシア,ウエルシア仙台泉高森店,宮城県仙台市泉区高森４丁目２−５３９
ウエルシア,ウエルシア仙台落合2丁目店,宮城県仙台市青葉区落合２丁目１６−１
ウエルシア,ウエルシア仙台長命ケ丘店,宮城県仙台市泉区長命ケ丘４丁目１−１
ウエルシア,ウエルシア仙台鶴が丘店,宮城県仙台市泉区鶴が丘１丁目３７−２
ウエルシア,ウエルシア利府青山店,宮城県宮城郡利府町青山２丁目１−９
ウエルシア,ウエルシア古川中里店,宮城県大崎市古川中里２丁目７−１
ウエルシア,ウエルシア名取増田店,宮城県名取市増田柳田5番地の1
ウエルシア,ウエルシア名取大手町店,宮城県名取市大手町５丁目3−２
ウエルシア,ウエルシア塩釜舟入店,宮城県塩竈市舟入２丁目３
ウエルシア,ウエルシア大河原高砂店,宮城県柴田郡大河原町高砂町２−７
ウエルシア,ウエルシア岩沼中央店,宮城県岩沼市中央４丁目１１−１３
ウエルシア,ウエルシア本塩釜駅前店,宮城県塩竈市海岸通１１−１
ウエルシア,ウエルシア石巻赤十字病院前店,宮城県石巻市あけぼの北１丁目1−７
ウエルシア,ウエルシア船岡中央店,宮城県柴田郡柴田町船岡中央３丁目１８−１０
カワチ薬品,カワチ薬品 あすと長町店,宮城県仙台市太白区あすと長町３丁目１２−２０
カワチ薬品,カワチ薬品 アクロスプラザ南光台東店,宮城県仙台市泉区松森陣ケ原１３−１０
カワチ薬品,カワチ薬品 フォレオ宮の杜店,宮城県仙台市宮城野区東仙台４丁目１４−１０
カワチ薬品,カワチ薬品 仙台ゆめタウン店,宮城県仙台市宮城野区中野３丁目３−１６
カワチ薬品,カワチ薬品 仙台東店,宮城県仙台市若林区伊在２丁目３−１
カワチ薬品,カワチ薬品 南吉成店,宮城県仙台市青葉区南吉成１丁目１５−３
カワチ薬品,カワチ薬品 古川店,宮城県大崎市古川穂波６丁目１−１０
カワチ薬品,カワチ薬品 古川駅東店,宮城県大崎市古川駅東２丁目１０−１６
カワチ薬品,カワチ薬品 塩がま店,宮城県塩竈市杉の入１丁目２１−１１
カワチ薬品,カワチ薬品 多賀城店,宮城県多賀城市笠神４丁目８−１
カワチ薬品,カワチ薬品 大河原店,宮城県柴田郡大河原町広表３９−１８
カワチ薬品,カワチ薬品 富沢店,宮城県仙台市太白区富沢２丁目２１−１８
カワチ薬品,カワチ薬品 富谷店,宮城県富谷市成田８丁目２−３
カワチ薬品,カワチ薬品 岩切店,宮城県仙台市宮城野区岩切分台２丁目１２−６
カワチ薬品,カワチ薬品 岩沼店,宮城県岩沼市たけくま２丁目３−５７
カワチ薬品,カワチ薬品 愛子店,宮城県仙台市青葉区上愛子榎２−１
カワチ薬品,カワチ薬品 栗生店,宮城県仙台市青葉区栗生６丁目１２−１
カワチ薬品,カワチ薬品 気仙沼店,宮城県気仙沼市赤岩杉ノ沢１２−１
カワチ薬品,カワチ薬品 石巻伊原津店,宮城県石巻市伊原津２丁目３−１９
カワチ薬品,カワチ薬品 石巻蛇田店,宮城県石巻市蛇田東道下28−１
カワチ薬品,カワチ薬品 石巻西店,宮城県石巻市恵み野４丁目１−１６
カワチ薬品,カワチ薬品 美田園店,宮城県名取市美田園５丁目５−６
カワチ薬品,カワチ薬品 若林店,宮城県仙台市若林区若林２丁目７−３０
カワチ薬品,カワチ薬品 荒井駅前店,宮城県仙台市若林区荒井東１丁目８−１
カワチ薬品,カワチ薬品 野村店,宮城県仙台市泉区野村菅間前７−１
カワチ薬品,カワチ薬品 長命ケ丘店,宮城県仙台市泉区長命ケ丘５丁目２３−３
クスリのアオキ,クスリのアオキ アムザ白石店,宮城県白石市大平森合森合沖１２１
クスリのアオキ,クスリのアオキ 二木店,宮城県岩沼市二木２丁目１−１
クスリのアオキ,クスリのアオキ 仙台今泉店,宮城県仙台市若林区上飯田４丁目１４−５８フレッシュフードモリヤ今泉店
クスリのアオキ,クスリのアオキ 仙台栗生店,宮城県仙台市青葉区栗生７丁目４−１３
クスリのアオキ,クスリのアオキ 佐沼店,宮城県登米市迫町佐沼萩洗２丁目１２−１０
クスリのアオキ,クスリのアオキ 六丁の目店,宮城県仙台市若林区伊在１丁目９−５
クスリのアオキ,クスリのアオキ 加美店,宮城県加美郡加美町矢越３７−１
クスリのアオキ,クスリのアオキ 古川江合店,宮城県大崎市古川江合錦町２丁目５−５
クスリのアオキ,クスリのアオキ 古川稲葉店,宮城県大崎市古川稲葉３丁目７−６
クスリのアオキ,クスリのアオキ 古川駅東店,宮城県大崎市古川駅東２丁目４−３５
クスリのアオキ,クスリのアオキ 大和吉岡店,宮城県黒川郡大和町吉岡まほろば２丁目１−３
クスリのアオキ,クスリのアオキ 大河原幸町店,宮城県柴田郡大河原町幸町３−１０
クスリのアオキ,クスリのアオキ 大河原店,宮城県柴田郡大河原町大谷西原前５３−２
クスリのアオキ,クスリのアオキ 大郷店,宮城県黒川郡大郷町中村屋鋪63番地の4
クスリのアオキ,クスリのアオキ 川崎店,宮城県柴田郡川崎町前川裏丁８０
クスリのアオキ,クスリのアオキ 桃生店,宮城県石巻市桃生町中津山江下45番地1
クスリのアオキ,クスリのアオキ 白石大畑店,宮城県白石市大畑一番９０
クスリのアオキ,クスリのアオキ 美田園店,宮城県名取市美田園７丁目１−１
クスリのアオキ,クスリのアオキ 船迫店,宮城県柴田郡柴田町西船迫２丁目８−７
クスリのアオキ,クスリのアオキ 荒井東店,宮城県仙台市若林区荒井東１丁目６−１
クスリのアオキ,クスリのアオキ 落合店,宮城県仙台市青葉区落合２丁目６−７
クスリのアオキ,クスリのアオキ 藤浪店,宮城県岩沼市藤浪１丁目４−１０
クスリのアオキ,クスリのアオキ 逢隈店,宮城県亘理郡亘理町逢隈牛袋南谷地添１７
クスリのアオキ,クスリのアオキ 錦ケ丘店,宮城県仙台市青葉区錦ケ丘１丁目２−８１
クスリのアオキ,クスリのアオキマルホンカウボーイ 村田店,宮城県柴田郡村田町小泉西浦７２
クスリのアオキ,クスリのアオキ仙台低温センター,宮城県仙台市宮城野区扇町５丁目１０−３６
クスリのアオキ,クスリのアオキ白石東町店,宮城県白石市東町３丁目５−６５
クスリのアオキ,クスリのアオキ角田梶賀店,宮城県角田市梶賀高畑南１２６
ココカラファイン,ココカラファイン セルバテラス店,宮城県仙台市泉区泉中央１丁目6−３セルバテラス1F
ココカラファイン,ココカラファイン 五橋店,宮城県仙台市若林区連坊小路１４２−１コンフォート五橋ステーション1F
ココカラファイン,ココカラファイン 仙台イービーンズ店,宮城県仙台市青葉区中央４丁目１−１イービーンズ1F
ココカラファイン,ココカラファイン 名取駅前店 - 閉業 -,宮城県名取市増田４丁目７−番20号グローリオレジデンス名取駅前2F
ココカラファイン,ココカラファイン 柴田店,宮城県柴田郡柴田町船岡新栄４丁目6−２１
サンドラッグ,サンドラッグ あすと長町店,宮城県仙台市太白区あすと長町２丁目２−１０
サンドラッグ,サンドラッグ 中山台店,宮城県仙台市青葉区中山台２丁目６０−１
サンドラッグ,サンドラッグ 仙台一番町店,宮城県仙台市青葉区一番町３丁目１０−２３ベルモーズビル１階
サンドラッグ,サンドラッグ 仙台中央通り店,宮城県仙台市青葉区中央２丁目２−２１
サンドラッグ,サンドラッグ 仙台八幡町店,宮城県仙台市青葉区八幡３丁目１−５０１F
サンドラッグ,サンドラッグ 仙台幸町店,宮城県仙台市宮城野区幸町３丁目１−２
サンドラッグ,サンドラッグ 仙台泉古内店,宮城県仙台市泉区古内坂ノ上１−２３
サンドラッグ,サンドラッグ 佐沼店,宮城県登米市迫町佐沼中江２丁目４−９
サンドラッグ,サンドラッグ 八乙女店,宮城県仙台市泉区八乙女１丁目３−９
サンドラッグ,サンドラッグ 利府店,宮城県宮城郡利府町利府堀切前１５−１
サンドラッグ,サンドラッグ 利府野中店,宮城県宮城郡利府町加瀬十三本塚１６７
サンドラッグ,サンドラッグ 南小泉店,宮城県仙台市若林区南小泉４丁目１０−６
サンドラッグ,サンドラッグ 名取バイパス店,宮城県名取市上余田字千刈田２８３−１
サンドラッグ,サンドラッグ 大河原フォルテ店,宮城県柴田郡大河原町小島２−１
サンドラッグ,サンドラッグ 富谷店,宮城県富谷市大清水２丁目13−１
サンドラッグ,サンドラッグ 岩沼相の原店,宮城県岩沼市相の原１丁目８−２７
サンドラッグ,サンドラッグ 愛子店,宮城県仙台市青葉区上愛子新宮前２２−１
サンドラッグ,サンドラッグ 石巻中里店,宮城県石巻市南中里２丁目９−４５
サンドラッグ,サンドラッグ 高森店,宮城県仙台市泉区高森７丁目２内
サンドラッグ,サンドラッグ 鶴ヶ谷店,宮城県仙台市宮城野区鶴ケ谷２丁目８−７
セイムス,ドラッグストア セイムス 石巻東中里店,宮城県石巻市東中里２丁目１１−１１
セイムス,ドラッグセイムス 仙台宮町店,宮城県仙台市青葉区宮町１丁目１−５９
セイムス,ドラッグセイムス 仙台榴岡店,宮城県仙台市宮城野区榴岡４丁目１−８
セイムス,ドラッグセイムス 仙台若林4丁目店,宮城県仙台市若林区若林４丁目１−１２
セイムス,ドラッグセイムス 名取増田店,宮城県名取市増田９丁目３−３６
セイムス,ドラッグセイムス 大崎古川東店,宮城県大崎市古川駅東２丁目９−７
セイムス,ドラッグセイムス 岩沼舘下店,宮城県岩沼市館下１丁目１−１０
セイムス,ドラッグセイムス 村田小泉店,宮城県柴田郡村田町小泉西浦８−１
セイムス,ドラッグセイムス 気仙沼店,宮城県気仙沼市四反田１５２
セイムス,ドラッグセイムス 石巻大街道店,宮城県石巻市大街道西１丁目１−２
セイムス,ドラッグセイムス仙台西中田店,宮城県仙台市太白区西中田５丁目１７−７５
ダイコクドラッグ,ダイコクドラッグ 仙台クリスロード店,宮城県仙台市青葉区中央２丁目２−３０1F
ダイコクドラッグ,ダイコクドラッグ仙台マーブルロード店,宮城県仙台市青葉区一番町３丁目１−２１
ツルハドラッグ,ツルハドラッグ TIC一番町店,宮城県仙台市青葉区青葉区一番町４丁目９−１８
ツルハドラッグ,ツルハドラッグ あすと長町店,宮城県仙台市太白区あすと長町４丁目３−５
ツルハドラッグ,ツルハドラッグ なないろの里店,宮城県仙台市若林区なないろの里３丁目4番地11
ツルハドラッグ,ツルハドラッグ 一番町店,宮城県仙台市青葉区一番町４丁目９−５
ツルハドラッグ,ツルハドラッグ 中田７丁目店,宮城県名取市上余田千刈田2−１９
ツルハドラッグ,ツルハドラッグ 二十人町店,宮城県仙台市宮城野区二十人町309−８
ツルハドラッグ,ツルハドラッグ 亘理店,宮城県亘理郡亘理町逢隈高屋柴北１００
ツルハドラッグ,ツルハドラッグ 亘理逢隈店,宮城県亘理郡亘理町逢隈鹿島西鹿島１
ツルハドラッグ,ツルハドラッグ 仙台上愛子店,宮城県仙台市青葉区上愛子雷神４−２
ツルハドラッグ,ツルハドラッグ 仙台上杉店,宮城県仙台市青葉区上杉６丁目１−１０
ツルハドラッグ,ツルハドラッグ 仙台上谷刈店,宮城県仙台市泉区上谷刈２丁目５−７
ツルハドラッグ,ツルハドラッグ 仙台中央通店,宮城県仙台市青葉区中央２丁目６−６
ツルハドラッグ,ツルハドラッグ 仙台中山店,宮城県仙台市青葉区中山７丁目２−３０
ツルハドラッグ,ツルハドラッグ 仙台中田店,宮城県仙台市太白区中田町法地北２１−１
ツルハドラッグ,ツルハドラッグ 仙台二の森店,宮城県仙台市宮城野区二の森１−１３
ツルハドラッグ,ツルハドラッグ 仙台二日町店,宮城県仙台市青葉区二日町１８18番20
ツルハドラッグ,ツルハドラッグ 仙台保春院前丁店,宮城県仙台市若林区保春院前丁5番地113
ツルハドラッグ,ツルハドラッグ 仙台北山店,宮城県仙台市青葉区北山１丁目９−２０
ツルハドラッグ,ツルハドラッグ 仙台南小泉店,宮城県仙台市若林区遠見塚３丁目１−１１
ツルハドラッグ,ツルハドラッグ 仙台原町店,宮城県仙台市宮城野区原町３丁目１−８
ツルハドラッグ,ツルハドラッグ 仙台台原店,宮城県仙台市青葉区台原５丁目１３−１０
ツルハドラッグ,ツルハドラッグ 仙台向山店,宮城県仙台市太白区向山４丁目２４−１３
ツルハドラッグ,ツルハドラッグ 仙台大和町5丁目店,宮城県仙台市若林区大和町５丁目１−１２
ツルハドラッグ,ツルハドラッグ 仙台大和町店,宮城県仙台市若林区大和町１丁目５−２６８−５
ツルハドラッグ,ツルハドラッグ 仙台太子堂店,宮城県仙台市太白区諏訪町１−７
ツルハドラッグ,ツルハドラッグ 仙台宮千代店,宮城県仙台市宮城野区宮千代３丁目６−６
ツルハドラッグ,ツルハドラッグ 仙台宮城野店,宮城県仙台市宮城野区宮城野１丁目２８−２８
ツルハドラッグ,ツルハドラッグ 仙台宮町店,宮城県仙台市青葉区宮町３丁目９−５
ツルハドラッグ,ツルハドラッグ 仙台富沢西店,宮城県仙台市太白区富沢西２丁目7番地の11
ツルハドラッグ,ツルハドラッグ 仙台小田原店,宮城県仙台市青葉区小田原５丁目３−２８
ツルハドラッグ,ツルハドラッグ 仙台小田原２丁目店,宮城県仙台市宮城野区小田原２丁目１−２６早坂ビル
ツルハドラッグ,ツルハドラッグ 仙台山田店,宮城県仙台市太白区山田上ノ台町１４−１６
ツルハドラッグ,ツルハドラッグ 仙台愛子店,宮城県仙台市青葉区愛子東１丁目４−３４
ツルハドラッグ,ツルハドラッグ 仙台支倉店,宮城県仙台市青葉区支倉町２−３
ツルハドラッグ,ツルハドラッグ 仙台新田店,宮城県仙台市宮城野区新田２丁目１７−５０
ツルハドラッグ,ツルハドラッグ 仙台新田東店,宮城県仙台市宮城野区新田東５丁目13番１９
ツルハドラッグ,ツルハドラッグ 仙台東中田店,宮城県仙台市太白区東中田２丁目３９−２７
ツルハドラッグ,ツルハドラッグ 仙台柳生店,宮城県仙台市太白区柳生１丁目１０−８
ツルハドラッグ,ツルハドラッグ 仙台榴岡店,宮城県仙台市宮城野区榴岡３丁目４−１２
ツルハドラッグ,ツルハドラッグ 仙台沖野店,宮城県仙台市若林区若林６丁目１１−５２
ツルハドラッグ,ツルハドラッグ 仙台泉中央3丁目店,宮城県仙台市泉区泉中央３丁目２−７
ツルハドラッグ,ツルハドラッグ 仙台泉中央店,宮城県仙台市泉区泉中央３丁目３７−７
ツルハドラッグ,ツルハドラッグ 仙台緑ヶ丘店,宮城県仙台市太白区緑ケ丘４丁目５−１
ツルハドラッグ,ツルハドラッグ 仙台茂庭店,宮城県仙台市太白区茂庭新御所川62番
ツルハドラッグ,ツルハドラッグ 仙台荒井東店,宮城県仙台市若林区荒井７丁目53番地の１
ツルハドラッグ,ツルハドラッグ 仙台荒町店,宮城県仙台市若林区荒町１４９−１
ツルハドラッグ,ツルハドラッグ 仙台落合店,宮城県仙台市青葉区落合１丁目２−４６
ツルハドラッグ,ツルハドラッグ 仙台西多賀店,宮城県仙台市太白区西多賀３丁目１−３０2階
ツルハドラッグ,ツルハドラッグ 仙台通町店,宮城県仙台市青葉区通町１丁目４−３４
ツルハドラッグ,ツルハドラッグ 仙台長命ヶ丘店,宮城県仙台市青葉区桜ケ丘７丁目４０−１
ツルハドラッグ,ツルハドラッグ 仙台長町4丁目店,宮城県仙台市太白区長町４丁目７−１８
ツルハドラッグ,ツルハドラッグ 仙台長町店,宮城県仙台市太白区長町南２丁目６−１０６番１０号
ツルハドラッグ,ツルハドラッグ 仙台鶴ヶ谷店,宮城県仙台市宮城野区鶴ケ谷２丁目８−１２
ツルハドラッグ,ツルハドラッグ 佐沼店,宮城県登米市迫町佐沼中江４丁目６６番地６
ツルハドラッグ,ツルハドラッグ 八乙女店,宮城県仙台市泉区八乙女３丁目１−３
ツルハドラッグ,ツルハドラッグ 六丁の目店,宮城県仙台市若林区伊在１丁目８−４
ツルハドラッグ,ツルハドラッグ 利府店,宮城県宮城郡利府町利府新大谷地53番地1
ツルハドラッグ,ツルハドラッグ 利府新太子堂店,宮城県宮城郡利府町森郷新椎の木前字新椎ノ木前13街区1画地の一部
ツルハドラッグ,ツルハドラッグ 北仙台駅前店,宮城県仙台市青葉区昭和町６−１０
ツルハドラッグ,ツルハドラッグ 南光台4丁目店,宮城県仙台市泉区南光台４丁目１28号
ツルハドラッグ,ツルハドラッグ 南光台中央店,宮城県仙台市泉区南光台７丁目３−２１
ツルハドラッグ,ツルハドラッグ 南光台店,宮城県仙台市泉区南光台南３丁目２０−６
ツルハドラッグ,ツルハドラッグ 南吉成店,宮城県仙台市青葉区南吉成３丁目１−２３
ツルハドラッグ,ツルハドラッグ 南方店,宮城県登米市南方町新島前16番3
ツルハドラッグ,ツルハドラッグ 南気仙沼店,宮城県気仙沼市仲町２丁目１−３０2号
ツルハドラッグ,ツルハドラッグ 古川中里店,宮城県大崎市古川中里５丁目１５−４１
ツルハドラッグ,ツルハドラッグ 古川南店,宮城県大崎市古川穂波７丁目２−１４
ツルハドラッグ,ツルハドラッグ 古川東店,宮城県大崎市古川旭３丁目８−８
ツルハドラッグ,ツルハドラッグ 古川福浦店,宮城県大崎市古川福浦３丁目１１40号
ツルハドラッグ,ツルハドラッグ 名取ゆりが丘店,宮城県名取市ゆりが丘４丁目2−５
ツルハドラッグ,ツルハドラッグ 名取バイパス店,宮城県名取市飯野坂３丁目４−４６
ツルハドラッグ,ツルハドラッグ 名取増田店,宮城県名取市増田北谷２６４−１
ツルハドラッグ,ツルハドラッグ 名取店,宮城県名取市田高原３６７
ツルハドラッグ,ツルハドラッグ 名取手倉田店,宮城県名取市手倉田諏訪568番地
ツルハドラッグ,ツルハドラッグ 塩釜店,宮城県塩竈市藤倉２丁目１４42号
ツルハドラッグ,ツルハドラッグ 塩釜栄町店,宮城県塩竈市栄町９−３６
ツルハドラッグ,ツルハドラッグ 塩釜白菊店,宮城県塩竈市白菊町３−74番地27
ツルハドラッグ,ツルハドラッグ 多賀城中央店,宮城県多賀城市中央３丁目６−１
ツルハドラッグ,ツルハドラッグ 多賀城町前店,宮城県多賀城市町前２丁目６−５
ツルハドラッグ,ツルハドラッグ 大和吉岡店,宮城県黒川郡大和町吉岡まほろば１丁目4番地の7
ツルハドラッグ,ツルハドラッグ 大和町4丁目店,宮城県仙台市若林区大和町４丁目６−４０
ツルハドラッグ,ツルハドラッグ 大河原小島店,宮城県柴田郡大河原町小島２１−５
ツルハドラッグ,ツルハドラッグ 大河原新南店,宮城県柴田郡大河原町新南４０−７
ツルハドラッグ,ツルハドラッグ 大野田店,宮城県仙台市太白区大野田３丁目１１−１５
ツルハドラッグ,ツルハドラッグ 宮城女川店,宮城県牡鹿郡女川町鷲神浜堀切山108番地8
ツルハドラッグ,ツルハドラッグ 宮城山元店,宮城県亘理郡山元町山寺石田45番１
ツルハドラッグ,ツルハドラッグ 宮城岩出山店,宮城県大崎市岩出山下野目山ノ辺１
ツルハドラッグ,ツルハドラッグ 宮城志津川店,宮城県本吉郡南三陸町志津川上の山69番１
ツルハドラッグ,ツルハドラッグ 宮城村田店,宮城県柴田郡村田町村田松崎8−１
ツルハドラッグ,ツルハドラッグ 宮城登米店,宮城県登米市登米町寺池目子待井74番2
ツルハドラッグ,ツルハドラッグ 宮城白石北店,宮城県白石市福岡長袋中河原２４−１
ツルハドラッグ,ツルハドラッグ 宮城白石店,宮城県白石市大手町１−８
ツルハドラッグ,ツルハドラッグ 宮城色麻店,宮城県加美郡色麻町四かま瀧149番1
ツルハドラッグ,ツルハドラッグ 宮城蔵王店,宮城県刈田郡蔵王町円田西浦上5番地
ツルハドラッグ,ツルハドラッグ 宮城鹿島台店,宮城県大崎市鹿島台木間塚小谷地２２８−１
ツルハドラッグ,ツルハドラッグ 富谷ひより台店,宮城県富谷市ひより台２丁目36−６
ツルハドラッグ,ツルハドラッグ 富谷上桜木店,宮城県富谷市上桜木２丁目3番地4
ツルハドラッグ,ツルハドラッグ 将監店,宮城県仙台市泉区将監殿２丁目1番2
ツルハドラッグ,ツルハドラッグ 小牛田北店,宮城県遠田郡美里町牛飼八反９７番
ツルハドラッグ,ツルハドラッグ 小牛田店,宮城県遠田郡美里町北浦１丁目26番地
ツルハドラッグ,ツルハドラッグ 小鶴新田店,宮城県仙台市宮城野区新田東３丁目１1番地の5
ツルハドラッグ,ツルハドラッグ 山田鈎取店,宮城県仙台市太白区山田田中前184番地
ツルハドラッグ,ツルハドラッグ 岩沼中央店,宮城県岩沼市中央２丁目５−２２
ツルハドラッグ,ツルハドラッグ 岩沼南店,宮城県岩沼市藤浪２丁目４−１１
ツルハドラッグ,ツルハドラッグ 市名坂店,宮城県仙台市泉区市名坂万吉前１１７−１
ツルハドラッグ,ツルハドラッグ 明石南店,宮城県仙台市泉区明石南３丁目４−４
ツルハドラッグ,ツルハドラッグ 東北大学病院前店,宮城県仙台市支倉町4-40
