company,store_name,address,latitude,longitude
ハシドラッグ,ハシドラッグ 八木田店,福島県福島市八木田並柳１６１−２,37.746349,140.44603
ハシドラッグ,ハシドラッグ 北店,福島県福島市笹谷片目清水３０−４,37.789707,140.446686
ハシドラッグ,ハシドラッグ 南福島店,福島県福島市太平寺児子塚５２−１,37.72823,140.45105
ハシドラッグ,ハシドラッグ 国見店,福島県伊達郡国見町藤田中沢四１,37.87183900000001,140.5444588
ハシドラッグ,ハシドラッグ 安達店,福島県二本松市油井腰巻７,37.61598,140.462725
ハシドラッグ,ハシドラッグ 川俣店,福島県伊達郡川俣町鶴沢社前８７,37.6732454,140.5660621
ハシドラッグ,ハシドラッグ 福島中央店,福島県福島市西中央２丁目８,37.760853,140.434753
ハシドラッグ,ハシドラッグ 腰浜店,福島県福島市腰浜町１４−４,37.756313,140.481003
ハシドラッグ,ハシドラッグ 船引店,福島県田村市船引町東部台４丁目３４,37.440472,140.58781
ハシドラッグ,ハシドラッグ 荒井店,福島県福島市荒井北３丁目12−５,37.724888,140.387787
ハシドラッグ,ハシドラッグ 西店,福島県福島市野田町道端７９,37.769089,140.438583
ハシドラッグ,ハシドラッグ 飯舘店,福島県相馬郡飯舘村草野大師堂１,37.6953554,140.7460239
ハシドラッグ,ハシドラッグ 鳥谷野店,福島県福島市鳥谷野芝切１８,37.732712,140.462555
マツモトキヨシ,ドラッグストア マツモトキヨシ いわき泉町店,福島県いわき市泉町下川薬師前１１３−１,36.9419089,140.8529146
マツモトキヨシ,ドラッグストア マツモトキヨシ エイトタウン相馬店,福島県相馬市黒木源多田４４,37.8074492,140.9115902
マツモトキヨシ,ドラッグストア マツモトキヨシ メガステージ石川店,福島県石川郡石川町長久保２３,37.1546662,140.4454798
マツモトキヨシ,ドラッグストア マツモトキヨシ ヨークタウン八山田店,福島県郡山市八山田西１丁目５４,37.4265431,140.3632159
マツモトキヨシ,ドラッグストア マツモトキヨシ ヨークタウン大槻店,福島県郡山市大槻町土瓜３７−１,37.40260749999999,140.327826
マツモトキヨシ,ドラッグストア マツモトキヨシ 会津西若松店,福島県会津若松市住吉町２４−３,37.4852625,139.9086666
マツモトキヨシ,ドラッグストア マツモトキヨシ 会津門田店,福島県会津若松市東年貢２丁目３−１,37.4737722,139.925326
マツモトキヨシ,ドラッグストア マツモトキヨシ 福島入江町店,福島県福島市入江町１１−３８,37.769485,140.48024
マツモトキヨシ,ドラッグストア マツモトキヨシ 福島笹谷店,福島県福島市笹谷東中條１４−６,37.78948020000001,140.4433022
マツモトキヨシ,ドラッグストア マツモトキヨシ 福島西店,福島県福島市南沢又中琵琶渕２７,37.770294,140.43837
マツモトキヨシ,ドラッグストア マツモトキヨシ 郡山堤店,福島県郡山市堤３丁目６,37.3988239,140.3329859
マツモトキヨシ,ドラッグストア マツモトキヨシ 郡山桑野店,福島県郡山市桑野２丁目３６−８,37.40418,140.3524446
マツモトキヨシ,ドラッグストア マツモトキヨシ 郡山横塚店,福島県郡山市横塚２丁目１０−３,37.3992093,140.3984272
マツモトキヨシ,ドラッグストア マツモトキヨシ 郡山鶴見坦店,福島県郡山市鶴見坦３丁目１６−２３,37.3923868,140.3582781
マツモトキヨシ,ドラッグストアマツモトキヨシ いわき平ペッペ店,福島県いわき市平六町目6−２,37.057458,140.8988559
マツモトキヨシ,ドラッグストアマツモトキヨシ 福島南店,福島県福島市黒岩浜井場３２,37.726887,140.468658
マツモトキヨシ,ドラッグストアマツモトキヨシ 郡山下亀田店,福島県郡山市下亀田１６−１６,37.4074704,140.3487396
マツモトキヨシ,ドラッグストアマツモトキヨシ 郡山御前南店,福島県郡山市御前南２丁目２８,37.382435,140.332367
マツモトキヨシ,薬 マツモトキヨシ エスパル福島店,福島県福島市栄町１−１,37.753189,140.460678
マツモトキヨシ,薬 マツモトキヨシ エスパル郡山店,福島県郡山市燧田195番地,37.3975182,140.3881295
薬王堂,薬王堂 いわき勿来店,福島県いわき市勿来町窪田御前崎25-1,36.896076,140.752777
薬王堂,薬王堂 いわき小川店,福島県いわき市小川町高萩字下代26-1,37.124947,140.861008
薬王堂,薬王堂 いわき山田店,福島県いわき市山田町毛内50,36.950939,140.745102
薬王堂,薬王堂 いわき永崎店,福島県いわき市永崎字橋出5-1,36.951382,140.934509
薬王堂,薬王堂 メガステージ二本松店,福島県二本松市作田237番地2,37.585804,140.440643
薬王堂,薬王堂 メガステージ会津坂下店,福島県河沼郡会津坂下町大字気多宮字柳田1004番地,37.569374,139.807098
薬王堂,薬王堂 二本松本町店,福島県二本松市本町一丁目212番地4,37.593342,140.43631
薬王堂,薬王堂 伊達梁川店,福島県伊達市梁川町大町一丁目40,37.859486,140.608902
薬王堂,薬王堂 伊達霊山町店,福島県伊達市霊山町下小国字夫婦清水28番,37.771179,140.598221
薬王堂,薬王堂 会津美里高田店,福島県大沼郡会津美里町字高田前川原3495番2,37.470669,139.853088
薬王堂,薬王堂 南相馬原町店,福島県南相馬市原町区中太田字天狗田93番2,37.618954,140.956787
薬王堂,薬王堂 南相馬鹿島店,福島県南相馬市鹿島区寺内字東前田42,37.69965,140.960876
薬王堂,薬王堂 原町大木戸北店,福島県南相馬市原町区大木戸字八方内79番地１,37.63559,140.938858
薬王堂,薬王堂 原町大木戸店,福島県南相馬市原町区大木戸字松島215-1,37.627014,140.945038
薬王堂,薬王堂 喜多方松山店,福島県喜多方市松山町鳥見山字上天神5番,37.6866,139.874863
薬王堂,薬王堂 小名浜元分店,福島県いわき市小名浜字元分12-1,36.947472,140.907471
薬王堂,薬王堂 小名浜定西店,福島県いわき市小名浜字定西264-1,36.947849,140.899567
薬王堂,薬王堂 本宮仁井田店,福島県本宮市仁井田字富士内9-1,37.489532,140.400024
薬王堂,薬王堂 本宮高木店,福島県本宮市高木字舟場3番地1,37.5135,140.407089
薬王堂,薬王堂 田村大越店,福島県田村市大越町上大越字湯田19番地1,37.391777,140.628006
薬王堂,薬王堂 田村船引店,福島県田村市船引町船引字川代88番地3,37.434895,140.594009
薬王堂,薬王堂 白河桜岡店,福島県白河市大桜岡前126-1,37.125744,140.244019
薬王堂,薬王堂 白河高山店,福島県白河市高山167番地1,37.117535,140.188782
薬王堂,薬王堂 相馬松川浦店,福島県相馬市尾浜字細田235,37.813194,140.938019
薬王堂,薬王堂 相馬沖ノ内店,福島県相馬市沖ノ内3丁目3番地7,37.80714,140.933426
薬王堂,薬王堂 福島中島店,福島県西白河郡中島村大字二子塚字山神山13番1,37.131172,140.348114
薬王堂,薬王堂 福島会津美里店,福島県大沼郡会津美里町字思堀73番地,37.456837,139.894897
薬王堂,薬王堂 福島塙店,福島県東白川郡塙町大字塙字本町106番地,36.954399,140.412018
薬王堂,薬王堂 福島大森店,福島県福島市大森字本町裏50番地,37.728134,140.439819
薬王堂,薬王堂 福島大玉店,福島県安達郡大玉村玉井字袋内113番地,37.522778,140.383957
薬王堂,薬王堂 福島太平寺店,福島県福島市太平寺字古内34番1,37.734818,140.455765
薬王堂,薬王堂 福島小野店,福島県田村郡小野町大字小野新町字中通90番地,37.279705,140.629654
薬王堂,薬王堂 福島川俣店,福島県伊達郡川俣町大字鶴沢字堂ノ窪22番地1,37.666389,140.582077
薬王堂,薬王堂 福島新地店,福島県相馬郡新地町谷地小屋字中田35番地の1,37.877151,140.922943
薬王堂,薬王堂 福島松川店,福島県福島市松川町字本町111番地1,37.657902,140.459961
薬王堂,薬王堂 福島棚倉店,福島県東白川郡棚倉町大字棚倉字日向前8番地1,37.029438,140.367111
薬王堂,薬王堂 福島石川店,福島県石川郡石川町字当町131,37.142712,140.442825
薬王堂,薬王堂 福島西郷店,福島県白河郡西郷村大字米字西原28番地2,37.126343,140.210953
薬王堂,薬王堂 福島鏡石店,福島県岩瀬郡鏡石町東町333,37.241039,140.34729
薬王堂,薬王堂 郡山堤店,福島県郡山市大槻町字堤西24番地1,37.399277,140.328247
薬王堂,薬王堂 郡山安積店,福島県郡山市安積4丁目55番地1,37.354736,140.362549
薬王堂,薬王堂 郡山富久山店,福島県郡山市富久山町久保田字宮田10番地1,37.409504,140.397842
薬王堂,薬王堂 須賀川木之崎店,福島県須賀川市木之崎字寺前71番4,37.277184,140.278152
薬王堂,薬王堂 須賀川東作店,福島県須賀川市東作48番1,37.277988,140.383316
