company,store_name,address,latitude,longitude
ウエルシア,ウエルシアいわき中央台東店,福島県いわき市中央台高久2-25-1,37.006136,140.932003
ウエルシア,ウエルシアいわき平中神谷店,福島県いわき市平中神谷字六本榎9-3,37.060008,140.930461
ウエルシア,ウエルシアいわき錦店,福島県いわき市錦町花ノ井30-1,36.908128,140.780481
ウエルシア,ウエルシアヨークタウンいわき泉玉露店,福島県いわき市泉玉露2-10-1ヨークタウン内,36.952207,140.852647
ウエルシア,ウエルシア二本松安達店,福島県二本松市油井濡石27-1,37.605732,140.464482
ウエルシア,ウエルシア伊達保原北店,福島県伊達市保原町大和107-1,37.827534,140.564781
ウエルシア,ウエルシア伊達保原店,福島県伊達市保原町前田町27-2,37.811325,140.554918
ウエルシア,ウエルシア伊達国見店,福島県伊達郡国見町藤田字中沢一10-1,37.869819,140.545413
ウエルシア,ウエルシア伊達新梁川店,福島県伊達市梁川町広瀬町43,37.845876,140.606116
ウエルシア,ウエルシア伊達桑折店,福島県伊達郡桑折町北町50-1,37.846074,140.5213
ウエルシア,ウエルシア会津坂下東店,福島県河沼郡会津坂下町小川原945,37.554175,139.832651
ウエルシア,ウエルシア会津美里店,福島県大沼郡会津美里町思堀25,37.454262,139.898157
ウエルシア,ウエルシア会津若松湯川店,福島県会津若松市湯川町4-10,37.485084,139.923527
ウエルシア,ウエルシア南相馬原ノ町駅前店,福島県南相馬市原町区旭町2-52-1,37.634632,140.972029
ウエルシア,ウエルシア喜多方常盤台店,福島県喜多方市常盤台46-1,37.664603,139.875211
ウエルシア,ウエルシア小野新町店,福島県田村郡小野町小野新町品ノ木1-1,37.290317,140.625467
ウエルシア,ウエルシア岩瀬鏡石店,福島県岩瀬郡鏡石町不時沼205,37.252785,140.350265
ウエルシア,ウエルシア東白川棚倉店,福島県東白川郡棚倉町流字餅田16-1,37.012111,140.394724
ウエルシア,ウエルシア田村船引店,福島県田村市船引町船引宮ノ前81,37.437296,140.56097
ウエルシア,ウエルシア福島八島田店,福島県福島市八島田8-1,37.764806,140.434719
ウエルシア,ウエルシア福島大森店,福島県福島市大森堂ノ裏62,37.728763,140.446552
ウエルシア,ウエルシア福島早稲店,福島県福島市早稲町8-22一番丁キャッスル1F,37.748199,140.467044
ウエルシア,ウエルシア福島本宮店,福島県本宮市本宮舘町194,37.516016,140.401701
ウエルシア,ウエルシア福島玉川店,福島県石川郡玉川村小高稲荷畷24-1,37.209058,140.409856
ウエルシア,ウエルシア福島鎌田店,福島県福島市鎌田西5-1,37.788286,140.48752
ウエルシア,ウエルシア福島飯坂店,福島県福島市飯坂町月崎町12-4,37.822564,140.449523
ウエルシア,ウエルシア西会津店,福島県耶麻郡西会津町野沢原町611,37.580439,139.647418
ウエルシア,ウエルシア西白河中島店,福島県西白河郡中島村二子塚字浦山32-16,37.141088,140.352156
ウエルシア,ウエルシア西白河西郷店,福島県西白河郡西郷村米字中山前84-10,37.128232,140.193002
ウエルシア,ウエルシア郡山富田店,福島県郡山市名郷田2-48,37.415926,140.362922
ウエルシア,ウエルシア郡山小原田店,福島県郡山市小原田3-3-14,37.376712,140.389223
ウエルシア,ウエルシア郡山朝日２丁目店,福島県郡山市朝日2-5-16,37.402626,140.364977
ウエルシア,ウエルシア郡山桑野店,福島県郡山市桑野4-6-2,37.4055,140.357055
ウエルシア,ウエルシア郡山長者店,福島県郡山市長者1-6-20,37.39613,140.370257
ウエルシア,ウエルシア郡山開成店,福島県郡山市開成6-149-1,37.384527,140.358325
ウエルシア,ウエルシア郡山駅東口店,福島県郡山市谷島町6-18,37.393271,140.398358
カワチ薬品,カワチ薬品 上荒川店,福島県いわき市平上荒川堀ノ内１,37.0370676,140.8922992
カワチ薬品,カワチ薬品 会津アピオ店,福島県会津若松市町北町大字始宮前１０−３,37.519064,139.915313
カワチ薬品,カワチ薬品 会津坂下店,福島県河沼郡会津坂下町舘ノ下７０,37.5661265,139.8176626
カワチ薬品,カワチ薬品 会津若松中央店,福島県会津若松市中央２丁目３−７,37.5019888,139.930574
カワチ薬品,カワチ薬品 原町店,福島県南相馬市原町区北町２９３,37.6464907,140.951065
カワチ薬品,カワチ薬品 城清水店,福島県郡山市城清水１８,37.3762519,140.3719148
カワチ薬品,カワチ薬品 安積店,福島県郡山市安積町荒井雁股８−１０１,37.3749633,140.3547338
カワチ薬品,カワチ薬品 棚倉店,福島県東白川郡棚倉町下山本愛宕平6,36.9971656,140.3906198
カワチ薬品,カワチ薬品 泉店,福島県いわき市泉町７丁目20−２２,36.9519417,140.8593852
カワチ薬品,カワチ薬品 湯本店,福島県いわき市常磐西郷町落合４１,36.9868584,140.8547344
カワチ薬品,カワチ薬品 白河店,福島県白河市昭和町１８８,37.1289939,140.201999
カワチ薬品,カワチ薬品 白河東店,福島県白河市中田２３−１,37.1198773,140.2318106
カワチ薬品,カワチ薬品 相馬店,福島県相馬市中野寺前３７７−１,37.7904071,140.9293367
カワチ薬品,カワチ薬品 石川店,福島県石川郡石川町双里４３−２,37.148716,140.468124
カワチ薬品,カワチ薬品 福島さくら店,福島県福島市さくら３丁目7−３,37.7261563,140.3854541
カワチ薬品,カワチ薬品 福島南店,福島県福島市鳥谷宮畑５１−５３,37.7335499,140.4674638
カワチ薬品,カワチ薬品 福島東店,福島県福島市高野河原下１６−２,37.7724858,140.491229
カワチ薬品,カワチ薬品 福島西店,福島県福島市泉下鎌２９−１,37.7793891,140.4524123
カワチ薬品,カワチ薬品 笹谷店,福島県福島市笹谷字中谷地１１−１,37.7946768,140.4415828
カワチ薬品,カワチ薬品 鎌田店,福島県福島市鎌田舟戸９−８,37.7931556,140.4889373
カワチ薬品,カワチ薬品 須賀川店,福島県須賀川市陣場町1−１,37.2984937,140.3667941
カワチ薬品,カワチ薬品会津若松南店,福島県会津若松市飯寺南２丁目１−８０,37.4712848,139.906397
カワチ薬品,カワチ薬品喜多方西店,福島県喜多方市押切南２丁目１２,37.64837320000001,139.859063
カワチ薬品,カワチ薬品富田店,福島県郡山市富田町西１丁目３,37.4192828,140.3425998
コクミン,コクミンドラッグ福島駅店,福島県福島市栄町1-1駅西口パワーシティピボット内,37.752141,140.461888
ココカラファイン,いわき市,福島県の浜通り南部に位置する市。中核市に指定されている。1966年成立。福島県浜通り地域の行政・経済・文化の中心地である。面積は福島県内で最大であり、人口においては郡山市に次ぐ県内2位、東北地方では仙台市、,37.750031,140.467773
ココカラファイン,コクミンドラッグ 福島駅店,福島県福島市栄町１−１駅西口パワーシティピボット内,37.7549427,140.4585958
ココカラファイン,ココカラLIFE西ノ内教室,福島県郡山市西ノ内１丁目３−２４成和ビル,37.406944,140.375122
ココカラファイン,ココカラファイン 会津若松店,福島県会津若松市飯寺南４丁目６−２２,37.4730792,139.904193
ココカラファイン,ココカラファイン 喜多方店,福島県喜多方市江中子４１７９,37.64822230000001,139.8804289
ココカラファイン,サンドラッグ 田村店,福島県田村市船引町船引源次郎１１９−４,37.4477906,140.5816519
ココカラファイン,トミードラッグ,福島県白河市一番町２９,37.12747,140.2049321
ココカラファイン,小規模保育事業所・ココカラ開成,福島県郡山市開成４丁目９−１７1階102号,37.390347,140.355438
ココカラファイン,（株）ピーエイケア,福島県郡山市開成４丁目９−１７,37.390701,140.355484
コスモス,ドラッグストアコスモス 白河老久保店,福島県白河市老久保１２,37.117154,140.200598
サンドラッグ,サンドラッグ あだたら店,福島県二本松市油井中田１−１コープマートあだたら店内,37.6040604,140.4597311
サンドラッグ,サンドラッグ いずみ店,福島県福島市森合清水７,37.772007,140.441528
サンドラッグ,サンドラッグ いわきエブリア店,福島県いわき市鹿島町米田日渡,36.993458,140.904968
サンドラッグ,サンドラッグ やのめ店,福島県福島市南矢野目向原１−１店内,37.784351,140.465179
サンドラッグ,サンドラッグ 二本松インター店,福島県二本松市成田町１丁目８１０,37.5891217,140.422281
サンドラッグ,サンドラッグ 伊達店,福島県伊達市原島８−１,37.8218896,140.5071759
サンドラッグ,サンドラッグ 会津若松アピオ店,福島県会津若松市インター西１１６116,37.5205378,139.9166628
サンドラッグ,サンドラッグ 八木田店,福島県福島市八木田中島１２８−１,37.749786,140.445587
サンドラッグ,サンドラッグ 方木田店,福島県福島市大森北島２０−１,37.739307,140.447678
サンドラッグ,サンドラッグ 植田店,福島県いわき市佐糠町碇田９１−１,36.916367,140.803635
サンドラッグ,サンドラッグ 猪苗代店,福島県耶麻郡猪苗代町芦原９７,37.5575852,140.1085129
サンドラッグ,サンドラッグ 須賀川店,福島県須賀川市高久田境９５−１,37.2745984,140.3681426
サンドラッグ,サンドラッグ 須賀川森宿店,福島県須賀川市森宿北向８８,37.3098304,140.3636157
サンドラッグ,ツルハドラッグ 喜多方南店,福島県喜多方市関柴町上高額前田１７５０−７,37.6416119,139.8858264
サンドラッグ,ツルハドラッグ 喜多方塩川店,福島県喜多方市塩川町東栄町５丁目6番３,37.595429,139.892639
サンドラッグ,ツルハドラッグ 喜多方西店,福島県喜多方市押切南２丁目５１−２,37.64553799999999,139.8585653
サンドラッグ,ツルハドラッグ 相馬南店,福島県相馬市馬場野雨田９−１,37.79006690000001,140.9311394
サンドラッグ,ツルハドラッグ 相馬店,福島県相馬市小泉根岸96番地1,37.8103773,140.9252572
サンドラッグ,ツルハドラッグ 相馬桜ヶ丘店,福島県相馬市中村桜ケ丘１３０130番,37.802279,140.919063
ツルハドラッグ,ツルハドラッグ いわきニュータウン店,福島県いわき市中央台飯野4丁目1,37.012134103547794,140.9152298398686
ツルハドラッグ,ツルハドラッグ いわき三倉店,福島県いわき市平字三倉66番5,37.050803733925385,140.90045976686477
ツルハドラッグ,ツルハドラッグ いわき下湯長谷店,福島県いわき市常磐下湯長谷町字シザ７１番地,36.990715,140.853585
ツルハドラッグ,ツルハドラッグ いわき下神谷店,福島県いわき市字仲田98-1,37.07522326844096,140.95303557242204
ツルハドラッグ,ツルハドラッグ いわき中岡店,福島県いわき市中岡町4丁目5-10,36.920947,140.781394
ツルハドラッグ,ツルハドラッグ いわき久之浜店,福島県いわき市久之浜町久之浜字堀ノ内9番地,37.14465882127057,140.99574456188202
ツルハドラッグ,ツルハドラッグ いわき内郷店,福島県いわき市内郷高坂町八反田2-21,37.04448038277303,140.86012947203807
ツルハドラッグ,ツルハドラッグ いわき四倉店,福島県いわき市四倉町上仁井田字南姥田６１番１,37.094304,140.976953
ツルハドラッグ,ツルハドラッグ いわき好間店,福島県いわき市好間町下好間字鬼越131,37.05956381291907,140.8726997999949
ツルハドラッグ,ツルハドラッグ いわき泉店,福島県いわき市泉町滝尻字御前田46番,36.947892,140.859706
ツルハドラッグ,ツルハドラッグ いわき湯本店,福島県いわき市常磐水野谷町諏訪ヶ崎5-1,36.99648215456279,140.8600114076721
ツルハドラッグ,ツルハドラッグ いわき童子町店,福島県いわき市平字童子町3-14,37.05143448938728,140.88713251078553
ツルハドラッグ,ツルハドラッグ いわき錦店,福島県いわき市錦町中央二丁目8番地1,36.9058688198237,140.789164288025
ツルハドラッグ,ツルハドラッグ いわき鹿島SC店,福島県いわき市鹿島町米田字手倉7番地2,36.99648946437177,140.90573502730936
ツルハドラッグ,ツルハドラッグ さくらモールとみおか店,福島県双葉郡富岡町中央三丁目53番地,37.3393912942064,141.01538679265977
ツルハドラッグ,ツルハドラッグ 二本松上竹店,福島県二本松市上竹2丁目275番地1,37.585242,140.449197
ツルハドラッグ,ツルハドラッグ 会津七日町店,福島県会津若松市西七日町21番10号,37.50478,139.914746
ツルハドラッグ,ツルハドラッグ 会津南町店,福島県会津若松市南町65-1,37.48440125711546,139.927101030631
ツルハドラッグ,ツルハドラッグ 会津坂下インター店,福島県河沼郡会津坂下町大字坂本字下新田丁317,37.55630412132118,139.7631202209489
ツルハドラッグ,ツルハドラッグ 会津坂下店,福島県河沼郡会津坂下町舘ノ下5-6,37.564992627062686,139.8190661549398
ツルハドラッグ,ツルハドラッグ 会津扇町店,福島県会津若松市白虎町3丁目8-14,37.50973659085384,139.93687530686313
ツルハドラッグ,ツルハドラッグ 会津旭町店,福島県会津若松市旭町7番26号,37.499965,139.938304
ツルハドラッグ,ツルハドラッグ 会津本町店,福島県会津若松市本町10番1号,37.49379897453164,139.9224749067458
ツルハドラッグ,ツルハドラッグ 会津河東店,福島県会津若松市河東町大字南高野字向原12-1,37.55307897727269,139.9297722343509
ツルハドラッグ,ツルハドラッグ 会津滝沢店,福島県会津若松市北滝沢二丁目1-38,37.51116637432008,139.94619452966052
ツルハドラッグ,ツルハドラッグ 会津真宮店,福島県会津若松市真宮新町北2丁目9,37.52295570812392,139.871897271195
ツルハドラッグ,ツルハドラッグ 会津美里店,福島県大沼郡会津美里町字高田前川原3553,37.470616841764254,139.8532936652897
ツルハドラッグ,ツルハドラッグ 会津門田店,福島県会津若松市北青木2番61号,37.481065719235744,139.93721381367456
ツルハドラッグ,ツルハドラッグ 会津高田店,福島県大沼郡会津美里町字布才地581-1,37.463852,139.836387
ツルハドラッグ,ツルハドラッグ 保原店,福島県伊達市保原町上保原字金山3-1,37.80925224308505,140.54852198391518
ツルハドラッグ,ツルハドラッグ 勿来店,福島県いわき市錦町江栗大町16-1,36.90834626174596,140.77192882671338
ツルハドラッグ,ツルハドラッグ 南会津バイパス店,福島県南会津郡南会津町田島字田島柳31番地,37.204821,139.778363
ツルハドラッグ,ツルハドラッグ 南会津下郷店,福島県南会津郡下郷町大字中妻字大百刈９５番地,37.26172875200359,139.8774381877316
ツルハドラッグ,ツルハドラッグ 南会津店,福島県南会津郡南会津町田島字谷地甲55-11,37.20229219097234,139.76945583402082
ツルハドラッグ,ツルハドラッグ 原町中央店,福島県南相馬市南町１丁目4番１,37.63798627999863,140.95699197668648
ツルハドラッグ,ツルハドラッグ 原町店,福島県南相馬市北原256,37.62763119706658,140.9885664919857
ツルハドラッグ,ツルハドラッグ 原町牛越店,福島県南相馬市牛越字高田60番地の１,37.6409674500068,140.944821276214
ツルハドラッグ,ツルハドラッグ 原町西店,福島県南相馬市国見町2丁目120-1,37.627679,140.95284
ツルハドラッグ,ツルハドラッグ 原町錦店,福島県南相馬市錦町2-60‐1,37.640989757448594,140.97096744084183
ツルハドラッグ,ツルハドラッグ 喜多方上江店,福島県喜多方市字上江3647番地4,37.654985524041486,139.8853927865082
ツルハドラッグ,ツルハドラッグ 喜多方南店,福島県喜多方市上高額字前田1750－7,37.64161187697962,139.88582641184442
ツルハドラッグ,ツルハドラッグ 喜多方塩川店,福島県喜多方市塩川町字東栄町五丁目6番3,37.595429,139.892639
ツルハドラッグ,ツルハドラッグ 喜多方西店,福島県喜多方市字押切南二丁目51-2,37.64553801977823,139.8585653252595
ツルハドラッグ,ツルハドラッグ 塙店,福島県東白川郡塙町大字塙字大町1丁目13番地,36.959051,140.409666
ツルハドラッグ,ツルハドラッグ 小名浜店,福島県いわき市小名浜岡小名字小館19-6,36.959708514560425,140.90342425366234
ツルハドラッグ,ツルハドラッグ 小名浜神白店,福島県いわき市小名浜下神白字狩亦59-15,36.948651,140.926899
ツルハドラッグ,ツルハドラッグ 小野店,福島県田村郡大字飯豊字坂東内前31番地,37.29826048,140.6185306
ツルハドラッグ,ツルハドラッグ 川俣中央店,福島県伊達郡川俣町字段ノ腰18番地,37.66373817400506,140.59798223600254
ツルハドラッグ,ツルハドラッグ 川俣店,福島県伊達郡川俣町大字鶴沢字学校前20-1,37.665592639101085,140.57646565130435
ツルハドラッグ,ツルハドラッグ 平窪店,福島県いわき市平下平窪山土内町1‐1,37.08386364,140.8778143
ツルハドラッグ,ツルハドラッグ 新地店,福島県相馬郡新地町谷地小屋字樋ノ口36番地1,37.8785058547317,140.915800659609
ツルハドラッグ,ツルハドラッグ 本宮中央店,福島県本宮市本宮字万世195番1,37.51414864352147,140.3946759873878
ツルハドラッグ,ツルハドラッグ 本宮店,福島県本宮市荒井字久保田132-8-2,37.48649374999043,140.3796476782339
ツルハドラッグ,ツルハドラッグ 梁川店,福島県伊達市梁川町字町裏３４-１,37.858055,140.605525
ツルハドラッグ,ツルハドラッグ 棚倉店,福島県東白川郡棚倉町大字棚倉字広畑55,37.02893121154695,140.37362472363006
ツルハドラッグ,ツルハドラッグ 浅川店,福島県石川郡浅川町大字浅川字月斉陣場1番地の３,37.080742346291046,140.42008652178515
ツルハドラッグ,ツルハドラッグ 猪苗代店,福島県耶麻郡猪苗代町字梨木西11,37.55755891273089,140.1139232108065
ツルハドラッグ,ツルハドラッグ 田村大越店,福島県田村市大越町下大越字中田38番地1,37.40312239211376,140.61728436203467
ツルハドラッグ,ツルハドラッグ 田村常葉店,福島県田村市常葉町常葉字平舘31番地,37.4387189769487,140.639263466143
ツルハドラッグ,ツルハドラッグ 白河モール店,福島県白河市老久保73-1白河モール内,37.11532113885409,140.2002496779966
ツルハドラッグ,ツルハドラッグ 白河大信店,福島県白河市大信町屋字朴田61番3,37.20442050840164,140.24889432247335
ツルハドラッグ,ツルハドラッグ 白河東店,福島県白河市東釜子字田町190-1,37.10539166522301,140.34830220110624
ツルハドラッグ,ツルハドラッグ 白河白坂店,福島県白河市白坂三輪台16－1,37.10054611042497,140.19659594983275
ツルハドラッグ,ツルハドラッグ 白河結城店,福島県白河市結城44番地,37.11948173694988,140.22840762853886
ツルハドラッグ,ツルハドラッグ 白河表郷店,福島県白河市表郷金山字前沢田３番地,37.05555330893011,140.30287045652554
ツルハドラッグ,ツルハドラッグ 白河西店,福島県白河市和尚壇2-45,37.12905513979232,140.19217084020522
ツルハドラッグ,ツルハドラッグ 相馬南店,福島県相馬市馬場野字雨田9-1,37.79006687695679,140.93113938146556
ツルハドラッグ,ツルハドラッグ 相馬店,福島県相馬市小泉字根岸96番地1,37.81037729,140.9252572
ツルハドラッグ,ツルハドラッグ 相馬桜ヶ丘店,福島県相馬市中村字桜ヶ丘130番,37.802279,140.919063
ツルハドラッグ,ツルハドラッグ 矢吹中央インター店,福島県西白河郡矢吹町八幡町778,37.189648792736165,140.33692938331797
ツルハドラッグ,ツルハドラッグ 矢吹北店,福島県西白河郡矢吹町北町164番地5,37.2119431148227,140.325992977751
ツルハドラッグ,ツルハドラッグ 矢吹店,福島県西白河郡矢吹町八幡町418番の2,37.19561661713065,140.3323537767212
ツルハドラッグ,ツルハドラッグ 矢祭店,福島県東白川郡矢祭町大字小田川字恩岩36-１,36.866392,140.425767
ツルハドラッグ,ツルハドラッグ 石川店,福島県石川郡石川町字長久保82番,37.152428,140.445889
ツルハドラッグ,ツルハドラッグ 神谷店,福島県いわき市平塩字出口2-11,37.06012521181326,140.92190311096547
ツルハドラッグ,ツルハドラッグ 福島南矢野目店,福島県福島市南矢野目字中江12番地の６,37.78760949814468,140.45500601295245
ツルハドラッグ,ツルハドラッグ 福島古殿店,福島県石川郡古殿町大字田口字平舘40-1,37.09310260403887,140.53062008793458
ツルハドラッグ,ツルハドラッグ 福島平田店,福島県石川郡平田村大字上蓬田字馬道23-1,37.23534805441288,140.57107476688213
ツルハドラッグ,ツルハドラッグ 福島庭坂店,福島県福島市町庭坂字町尻14番2,37.76712845859005,140.38957436903175
ツルハドラッグ,ツルハドラッグ 福島方木田店,福島県福島市方木田字前白家9-2,37.74458893418269,140.45141492829157
ツルハドラッグ,ツルハドラッグ 福島泉崎店,福島県西白河郡泉崎村大字泉崎字八丸165番1,37.15228358462905,140.3031335878796
ツルハドラッグ,ツルハドラッグ 福島笹木野店,福島県福島市笹木野字大金谷南5-5,37.76791128,140.4265925
ツルハドラッグ,ツルハドラッグ 福島飯坂店,福島県福島市飯坂町平野字上前田6番地1,37.80610722242378,140.44757933780352
ツルハドラッグ,ツルハドラッグ 船引店,福島県田村市船引町船引字川代3-9,37.434090647354914,140.59206661042424
ツルハドラッグ,ツルハドラッグ 西郷店,福島県西白河郡西郷村大字熊倉字折口原２５４番１,37.13943417105927,140.15269101089595
ツルハドラッグ,ツルハドラッグ 郡山久保田店,福島県郡山市富久山町久保田字大久保1-1,37.41019104914935,140.37940306518192
ツルハドラッグ,ツルハドラッグ 郡山台新店,福島県郡山市台新2丁目33番26号,37.39103976864218,140.34147174611726
ツルハドラッグ,ツルハドラッグ 郡山堤店,福島県郡山市堤1丁目1-26,37.39893558749066,140.33883988340122
ツルハドラッグ,ツルハドラッグ 郡山守山店,福島県郡山市田村町守山字御殿河原１１７-１,37.33606172882249,140.4096323576749
ツルハドラッグ,ツルハドラッグ 郡山富田店,福島県郡山市名郷田1丁目1番地,37.41746394812697,140.36328803862304
ツルハドラッグ,ツルハドラッグ 郡山島店,福島県郡山市島二丁目44番29号,37.39799820230481,140.34691354936473
ツルハドラッグ,ツルハドラッグ 郡山日和田店,福島県郡山市日和田町字財ノ木原１５-１,37.44516097703816,140.38404140219356
ツルハドラッグ,ツルハドラッグ 郡山深沢店,福島県郡山市深沢一丁目8番27号,37.39092098446034,140.37201577023774
ツルハドラッグ,ツルハドラッグ 郡山片平店,福島県郡山市中ノ目1丁目17番,37.41921029980508,140.33319726796125
ツルハドラッグ,ツルハドラッグ 郡山笹川店,福島県郡山市笹川三丁目25番地1,37.356402039861926,140.36994757974307
ツルハドラッグ,ツルハドラッグ 郡山菜根店,福島県郡山市字菜根屋敷４１７番地,37.383566001593806,140.35620379966758
ツルハドラッグ,ツルハドラッグ 郡山金屋店,福島県郡山市田村町金屋字マセロ２０番地２,37.36810394413895,140.39059274036106
ツルハドラッグ,ツルハドラッグ 野田店,福島県福島市野田町4丁目1番3号,37.7609045553993,140.45409471152502
ツルハドラッグ,ツルハドラッグ 野田西店,福島県福島市野田町7丁目3-8,37.75784439244372,140.44223474790454
ツルハドラッグ,ツルハドラッグ 須賀川南店,福島県須賀川市高久田境132-6,37.27465017101528,140.36620799010734
ツルハドラッグ,ツルハドラッグ 須賀川大袋店,福島県須賀川市大袋町57番地1,37.284417,140.358639
ツルハドラッグ,ツルハドラッグ 須賀川店,福島県須賀川市仲の町87番,37.297798,140.383653
ツルハドラッグ,ツルハドラッグ 須賀川長沼店,福島県須賀川市志茂字六角65番地,37.28525523535371,140.24286901938058
ツルハドラッグ,ツルハドラッグ 鹿島寺内店,福島県南相馬市寺内字本屋敷28-1,37.700135,140.962553
ハシドラッグ,ハシドラッグ 伊達箱崎店,福島県伊達市箱崎布川８９,37.8203177,140.5185106
ハシドラッグ,ハシドラッグ 保原店,福島県伊達市保原町栄町３８−１,37.827114,140.558594
ハシドラッグ,ハシドラッグ 信陵店,福島県福島市笹谷出水頭１−２,37.79709,140.428387
